{
  "$schema": "https://json-schema.org/draft/2020-12/schema",
  "$id": "https://deepfield.dev/content/statuses.schema.json",
  "title": "statuses",
  "type": "object",
  "additionalProperties": false,
  "required": [
    "$schema",
    "table",
    "generated",
    "rows"
  ],
  "properties": {
    "$schema": {
      "const": "deepfield-content/1"
    },
    "table": {
      "type": "string"
    },
    "generated": {
      "type": "string"
    },
    "sourceSha": {
      "type": "string"
    },
    "rows": {
      "type": "array",
      "items": {
        "type": "object",
        "additionalProperties": false,
        "required": [
          "id",
          "channel",
          "speedFactor",
          "damagePerSecond",
          "damageTakenFactor",
          "armorDelta",
          "hardControl",
          "maxDurationSeconds"
        ],
        "properties": {
          "id": {
            "type": "string"
          },
          "channel": {
            "type": "string",
            "enum": [
              "Movement",
              "Thermal",
              "Toxin",
              "Defense",
              "Vulnerability",
              "Control",
              "Tether",
              "Detection"
            ]
          },
          "speedFactor": {
            "type": "number"
          },
          "damagePerSecond": {
            "type": "number"
          },
          "damageTakenFactor": {
            "type": "number"
          },
          "armorDelta": {
            "type": "number"
          },
          "hardControl": {
            "type": "boolean"
          },
          "maxDurationSeconds": {
            "type": "number"
          },
          "ignoresArmor": {
            "type": "boolean"
          },
          "ignoresShield": {
            "type": "boolean"
          }
        }
      }
    }
  }
}
